{
  "$schema": "http://json-schema.org/draft-07/schema#",
  "$id": "oebf://schema/0.1/profile",
  "title": "OEBF Profile",
  "type": "object",
  "required": ["$schema", "id", "type", "svg_file", "origin", "alignment", "assembly"],
  "additionalProperties": false,
  "properties": {
    "$schema":     { "type": "string" },
    "id":          { "type": "string", "pattern": "^[a-z0-9][a-z0-9-]*$" },
    "type":        { "type": "string", "const": "Profile" },
    "description": { "type": "string" },
    "svg_file":    { "type": "string" },
    "width":       { "type": "number", "exclusiveMinimum": 0 },
    "height":      { "type": ["number", "null"] },
    "origin": {
      "type": "object",
      "required": ["x", "y"],
      "properties": {
        "x": { "type": "number" },
        "y": { "type": "number" }
      }
    },
    "alignment": {
      "type": "string",
      "enum": ["center", "left-face", "right-face", "top-face", "bottom-face"]
    },
    "assembly": {
      "type": "array",
      "minItems": 1,
      "items": {
        "type": "object",
        "required": ["layer", "name", "material_id", "thickness", "function"],
        "properties": {
          "layer":       { "type": "integer", "minimum": 1 },
          "name":        { "type": "string" },
          "material_id": { "type": "string" },
          "thickness":   { "type": "number", "exclusiveMinimum": 0 },
          "function":    { "type": "string", "enum": ["finish", "structure", "insulation", "membrane", "service"] }
        }
      }
    }
  }
}
